{
  "manifest_version": "bigbounce-program/v1",
  "id": "anomaly-discovery",
  "title": "DESI anomaly discovery",
  "question": "What unusual spectra emerge from a full-scale DESI anomaly search, and which candidates survive scientific validation?",
  "papers": [
    { "paper": "anomaly-flagship", "role": "lead", "title": "Rebuilt DESI anomaly-science flagship (future primary paper)" },
    { "paper": "P3-support", "role": "support", "title": "DESI Public-ID Recovery Catalog (supporting release)" }
  ],
  "experiments": [
    { "id": "anomaly-bigae-18m-inference-historical", "depends_on": [] },
    { "id": "anomaly-silver-crossmatch", "depends_on": ["anomaly-bigae-18m-inference-historical"] },
    { "id": "anomaly-uncataloged-taxonomy", "depends_on": ["anomaly-silver-crossmatch"] },
    { "id": "anomaly-injection-recovery-test", "depends_on": ["anomaly-bigae-18m-inference-historical"] },
    { "id": "anomaly-neowise-crossmatch", "depends_on": ["anomaly-silver-crossmatch"] },
    { "id": "anomaly-gold-z6-qso-spectra", "depends_on": ["anomaly-uncataloged-taxonomy"] },
    { "id": "anomaly-photoz-latent-vectors", "depends_on": ["anomaly-bigae-18m-inference-historical"] },
    { "id": "anomaly-fnl-tracer-selection", "depends_on": [] },
    { "id": "anomaly-clean-rerun-scan", "depends_on": [] },
    { "id": "p3-dp3-15-heldout", "depends_on": [] },
    { "id": "p3-positional-dedup", "depends_on": [] },
    { "id": "p3-kfold-cv-gate", "depends_on": [] },
    { "id": "p3-planck-heldout-membership", "depends_on": [] },
    { "id": "p3-erosita-scaler-leakage-control", "depends_on": [] },
    { "id": "p3-nanograv-pta-mcmc", "depends_on": [] },
    { "id": "p3-multisurvey-summary-crossmatch", "depends_on": [] },
    { "id": "p3-umap-multiseed-stability", "depends_on": ["p3-multisurvey-summary-crossmatch"] },
    { "id": "p3-flagship-s8-enrichment", "depends_on": [] },
    { "id": "p3-flagship-s8-allwise-photometry", "depends_on": ["p3-flagship-s8-enrichment"] },
    { "id": "p3-flagship-s8-simbad-ned-crossmatch", "depends_on": ["p3-flagship-s8-enrichment"] },
    { "id": "p3-flagship-s8-taxonomy", "depends_on": ["p3-flagship-s8-simbad-ned-crossmatch"] },
    { "id": "p3-flagship-v2-enrichment", "depends_on": [] },
    { "id": "p3-flagship-v2-allwise-photometry", "depends_on": ["p3-flagship-v2-enrichment"] },
    { "id": "p3-flagship-v2-simbad-ned-crossmatch", "depends_on": ["p3-flagship-v2-enrichment"] },
    { "id": "p3-flagship-v2-taxonomy", "depends_on": ["p3-flagship-v2-simbad-ned-crossmatch"] },
    { "id": "anomaly-known-object-recovery-benchmark", "depends_on": [] },
    { "id": "anomaly-known-object-recovery-benchmark-v2", "depends_on": ["p3-flagship-v2-enrichment"] },
    { "id": "p3-ledger8-known-object-recovery-benchmark", "depends_on": ["p3-flagship-s8-enrichment"] },
    { "id": "anomaly-map-png-highz-abundance", "depends_on": [] },
    { "id": "anomaly-map-qso-large-angle-isotropy", "depends_on": ["anomaly-map-png-highz-abundance"] }
  ],
  "external_data": [
    { "name": "DESI DR1 iron zcatalog (zall-pix-iron.fits)", "link": "https://data.desi.lbl.gov/public/dr1/spectro/redux/iron/zcatalog/v1/zall-pix-iron.fits", "kind": "dataset", "license": null },
    { "name": "DESI DR1 (base release + coadd corpus)", "link": "https://data.desi.lbl.gov/public/dr1/", "kind": "dataset", "license": null },
    { "name": "SPARCL (spectra retrieval API)", "link": "https://astrosparcl.datalab.noirlab.edu/sparc", "kind": "api", "license": null },
    { "name": "NEOWISE IR variability catalog (IRSA)", "link": "https://irsa.ipac.caltech.edu/Missions/wise.html", "kind": "dataset", "license": null },
    { "name": "NANOGrav 15-yr dataset", "link": "https://data.nanograv.org/", "kind": "dataset", "license": null },
    { "name": "bamfai/bigbounce-anomaly-catalog (HF)", "link": "https://huggingface.co/datasets/bamfai/bigbounce-anomaly-catalog", "kind": "dataset", "license": null },
    { "name": "GitHub mirror (Hubify-Projects/bigbounce)", "link": "https://github.com/Hubify-Projects/bigbounce", "kind": "code-mirror", "license": null },
    { "name": "P3 Zenodo archive", "link": "https://doi.org/10.5281/zenodo.21461888", "kind": "zenodo-archive", "license": null }
  ],
  "full_reproduction": {
    "est_wall_clock": "The completed AUG-011 scan ran about 45.5 hours on a RunPod A4000 and verified 36,634 shard receipts. Full independent reruns remain download-bound and multi-day; downstream sample selection, validation, taxonomy, and manuscript work are still pending because the full shard corpus is not in this checkout.",
    "est_cost_usd": 7.74,
    "order": "The scan is complete: retain its sealed result as a distinct generation, acquire its verified shard/receipt corpus through an authorized source, then derive a threshold from the observed distribution before sample selection. Do not tune toward historical counts. Historical BigAE/H200 legs remain comparison-only or needs-data-restore."
  },
  "hubify": {
    "lab_slug": "bigbounce",
    "module_notes": "AUG-011 is complete and receipt-verified (36,634 groups; 27,547,223 unique TARGETIDs; 52,188 raw rows above the sealed S>5 threshold, all fibers including sky — NOT a science-candidate count; ~85% of the S>=8 tail are sky fibers per the 2026-09-03 provenance finding; science-target counts pending the provenance-filtered rerun). Its corpus is not present in this checkout and its named Hugging Face mirror returned unauthenticated/private 401, so Hubify must not present the completed corpus as anonymously forkable. Historical BigAE/H200 legs remain lineage, not live reproduction targets."
  }
}
